{
  "run_id": "20260306T000000Z",
  "created_utc": "2026-03-06T00:00:00Z",
  "manager": {
    "name": "manager-primary",
    "objective": "Produce auditable findings for Q1-Q3 with deterministic evidence logs."
  },
  "workers": [
    {
      "worker_id": "W01",
      "role": "evidence-collector",
      "question_ids": [
        "Q1",
        "Q2"
      ],
      "allowed_domains": [
        "example.com",
        "example.org"
      ],
      "blocked_domains": [
        "example.net"
      ],
      "output_files": [
        "workers/W01/journal.jsonl",
        "workers/W01/sources.ndjson"
      ],
      "budget_tokens": 12000,
      "escalation_threshold": 0.8,
      "constraints": [
        "Use primary sources only"
      ]
    },
    {
      "worker_id": "W02",
      "role": "counterpoint-analyst",
      "question_ids": [
        "Q3"
      ],
      "allowed_domains": [
        "example.com"
      ],
      "blocked_domains": [
        "example.net"
      ],
      "output_files": [
        "workers/W02/journal.jsonl",
        "workers/W02/sources.ndjson"
      ],
      "budget_tokens": 8000,
      "escalation_threshold": 0.7,
      "constraints": [
        "Log counter-evidence for every claim"
      ]
    }
  ]
}
